{
  "$schema": "../../schemas/evidence/source-pin.schema.json",
  "artifact": "OpenMW source",
  "commit": "f4bec41444214a7903bebd178389ca22ca13f646",
  "license": "GPL-3.0-only",
  "lua_api_revision": 129,
  "repository": "https://gitlab.com/OpenMW/openmw.git",
  "tag": "openmw-0.51.0",
  "version": "0.51.0"
}
